{
  "schema_version": "0.1",
  "case_id": "c_0004",
  "recipe": {
    "id": "food_400001",
    "name": "spicy shrimp tacos",
    "cuisine": "mexican",
    "minutes": 35,
    "main_ingredient": "shrimp",
    "ingredients": ["shrimp", "corn tortillas", "cabbage", "lime", "chili powder"],
    "key_ingredients": ["shrimp", "corn tortillas"],
    "diet_tags": [],
    "other_tags": []
  },
  "reasons": [
    {"code": "CUISINE_MATCH", "field": "cuisine_prefs", "value": "mexican", "weight": 0.4},
    {"code": "LIKED_INGREDIENT", "field": "liked_ingredients", "value": "shrimp", "weight": 0.3}
  ],
  "confidence": "low",
  "fallback": null,
  "excluded_by": ["no_peanut"],
  "case_type": "low_confidence"
}
